{
  "deck_key": "uber-india",
  "deck_id": "1I-QTXOLN2KExoR7e6qYFqL03lBo2MAA45sw3zMkw1Kg",
  "display_name": "Uber India × Navier",
  "deck_type": "partner_proposal",
  "partner_id": "uber-india",
  "live_deck_url": "https://docs.google.com/presentation/d/1I-QTXOLN2KExoR7e6qYFqL03lBo2MAA45sw3zMkw1Kg/edit",
  "canonical_market_scope": [
    "Mumbai & Konkan",
    "Goa",
    "Kerala — Kochi/Vizhinjam/backwaters",
    "Andaman & Nicobar",
    "Kolkata / Hooghly waterfront",
    "Chennai / ECR / Cuddalore / Puducherry"
  ],
  "editing_mode": "slides_api_only",
  "export_modes": [
    "pdf",
    "png_preview",
    "slides_summary",
    "slides_full_inventory"
  ],
  "brand_profile": "navier-gold-minimal",
  "image_policy": "n30_composite_only_no_atlas_images_market_specific_backgrounds",
  "economics_sheet_id": "1L6StDXDjdR26l_bIqRRH150B1rTeT9pHk76JKkG3rqw",
  "economics_url": "https://docs.google.com/spreadsheets/d/1L6StDXDjdR26l_bIqRRH150B1rTeT9pHk76JKkG3rqw/edit",
  "source_paths": [
    "partner-pitch/partners/uber-india.json",
    "data-clean/partners/uber-india.json",
    "finance/recal/agg-uber-india.json",
    "finance/growth-uber-india.json",
    "finance/uber-india-growth-case.json",
    "partner-pitch/partners/_growth-draft/uber-india.growth.json",
    "finance/_sheet_out/uber-india_unit_econ.xlsx",
    "data-clean/economics_by_route_id.json",
    "handoff/partner-map-model/multi-partner-deck-grok-handoff-2026-06-21/partner-deck-source-map.json",
    "handoff/partner-map-model/multi-partner-deck-grok-handoff-2026-06-21/partner-deck-grok-readiness-queue.json"
  ],
  "slide_manifest": "slide-manifest.json",
  "content_source": "content-source.json",
  "image_manifest": "image-manifest.json",
  "rules": [
    "docs/LIVE-DECK-RULES.md",
    "docs/BRAND-RULES.md",
    "docs/IMAGE-RULES.md",
    "docs/PARTNER-DECK-GROK-HANDOFF-PLAYBOOK.md",
    "assets/IMAGE-ROLE-CONTRACT.md"
  ],
  "last_pulled_at": "2026-06-21T14:42:31Z",
  "notes": "Tasklet deck-prep config for Uber India. Use the Uber India derivative source, not global Uber. High-value India consumer markets only; Kolkata and Chennai in scope; Priority B excluded. Grok must bind/create a live deck ID, pull full inventory, and apply via Slides API only. Live deck created from Grab template copy for PR65 bind pass. PR65 content applied; 11-slide trim. Current-spec refresh required: slide 3 KPIs, slide 10 TAM, six flush-left OPEX lines, cover logo/no-logo policy, and stable linked-image URL delivery only (no embedded-only image reuse).",
  "generation_type": "refresh-to-current-spec",
  "spec_refresh_required": true,
  "current_spec_requirements": {
    "spec_version": "wave10a-current-2026-06-22",
    "slide_3_market_overview_kpis": {
      "status": "refresh_required",
      "source": "transparent economics sheet + master tracker",
      "rule": "no stale KPIs; null beats unsupported"
    },
    "slide_10_tam": {
      "status": "refresh_required",
      "source": "growth_case / TAM economics sidecar",
      "rule": "include economics sidecar in export package"
    },
    "unit_economics_opex_6_line": {
      "status": "refresh_required",
      "lines": 6,
      "layout": "flush_left",
      "field_id_policy": "pull live object IDs per slide before editing; never assume duplicated/recreated IDs"
    },
    "image_delivery": {
      "status": "required",
      "rule": "stable registry URL only; no embedded-only blobs or temporary googleusercontent contentUrl"
    }
  },
  "asset_policy": {
    "no_reembed": true,
    "image_insert_mode": "stable_registry_url_only",
    "allowed_sources": [
      "deck-studio/assets/ASSET-REGISTRY.json source_url",
      "approved Drive/asset-host URL recorded back into registry"
    ],
    "forbidden_sources": [
      "live Slides contentUrl",
      "lh*-googleusercontent temporary URLs",
      "copy/paste embedded-only binaries"
    ],
    "missing_asset_behavior": "block_or_leave_null"
  },
  "cover_logos": {
    "navier_logo": {
      "path": "assets/logos/navier/navier-wordmark-white.png",
      "required": true
    },
    "partner_logo": {
      "partner": "Uber",
      "asset_key": "uber-logo",
      "path": "assets/logos/partners/uber/uber-logo.png",
      "official_source": "https://www.uber.com",
      "required": true,
      "status": "needs_sourcing"
    },
    "cover_policy": "navier_plus_partner_logo"
  },
  "last_spec_refreshed_at": "2026-06-22T02:16:30Z"
}