{
  "deck_key": "noon",
  "deck_id": "10yH0aMKJsSDhz2epxyZb9hMCyDSRYJp4DrPDYJQZ38A",
  "display_name": "Noon × Navier",
  "deck_type": "partner_proposal",
  "partner_id": "noon",
  "live_deck_url": "https://docs.google.com/presentation/d/10yH0aMKJsSDhz2epxyZb9hMCyDSRYJp4DrPDYJQZ38A/edit",
  "canonical_market_scope": [
    "UAE-first — Dubai/Abu Dhabi waterfront commerce and concierge use cases",
    "KSA/Egypt narrative-only until source-backed and sealed"
  ],
  "editing_mode": "slides_api_only",
  "export_modes": [
    "pdf",
    "png_preview",
    "slides_summary",
    "slides_full_inventory"
  ],
  "brand_profile": "navier-gold-minimal",
  "image_policy": "n30_composite_only_no_atlas_images_market_specific_backgrounds",
  "economics_sheet_id": "1v0ywhNFk_fA1JRVhizWlz89RKgQWlID9RD3LfBhVB2Y",
  "economics_url": "https://docs.google.com/spreadsheets/d/1v0ywhNFk_fA1JRVhizWlz89RKgQWlID9RD3LfBhVB2Y/edit",
  "source_paths": [
    "partner-pitch/partners/noon.json",
    "data-clean/partners/noon.json",
    "finance/recal/agg-noon.json",
    "finance/growth-noon.json",
    "finance/noon-growth-case.json",
    "partner-pitch/partners/_growth-draft/noon.growth.json",
    "finance/_sheet_out/noon_unit_econ.xlsx",
    "data-clean/economics_by_route_id.json",
    "handoff/partner-map-model/multi-partner-deck-grok-handoff-2026-06-21/partner-deck-source-map.json",
    "handoff/partner-map-model/multi-partner-deck-grok-handoff-2026-06-21/partner-deck-grok-readiness-queue.json"
  ],
  "slide_manifest": "slide-manifest.json",
  "content_source": "content-source.json",
  "image_manifest": "image-manifest.json",
  "rules": [
    "docs/LIVE-DECK-RULES.md",
    "docs/BRAND-RULES.md",
    "docs/IMAGE-RULES.md",
    "docs/PARTNER-DECK-GROK-HANDOFF-PLAYBOOK.md"
  ],
  "last_pulled_at": "2026-06-21T14:42:06Z",
  "notes": "Tasklet deck-prep config for Noon. UAE-first commerce and concierge water layer. KSA/Egypt remain narrative-only unless source-backed, ID-bound, and economics-cascaded. Grok must bind/create a live deck ID, pull full inventory, and apply via Slides API only. Live deck created from Grab template copy for PR65 bind pass. PR65 content applied; 11-slide trim."
}
