{
  "deck_key": "singapore-mpa",
  "deck_id": "pending-grok-create-or-bind",
  "display_name": "Singapore MPA × Navier",
  "deck_type": "partner_proposal",
  "partner_id": "singapore-mpa",
  "live_deck_url": "https://docs.google.com/presentation/d/pending-grok-create-or-bind/edit",
  "canonical_market_scope": [
    "singapore",
    "desaru-coast-malaysia",
    "riau-islands-indonesia"
  ],
  "editing_mode": "slides_api_only",
  "export_modes": [
    "pdf",
    "png_preview",
    "slides_summary",
    "slides_full_inventory"
  ],
  "brand_profile": "navier-gold-minimal",
  "image_policy": "n30_composite_only_no_atlas_images_market_specific_backgrounds",
  "economics_sheet_id": null,
  "economics_url": null,
  "source_paths": [
    "partner-pitch/partners/singapore-mpa.json",
    "data-clean/partners/singapore-mpa.json",
    "finance/PARTNER-SHEET-IDS.json",
    "finance/economics_url_map.json",
    "handoff/partner-map-model/multi-partner-deck-grok-handoff-wave10a-2026-06-21/partner-deck-source-map.json",
    "handoff/partner-map-model/multi-partner-deck-grok-handoff-wave10a-2026-06-21/partner-deck-grok-readiness-queue.json",
    "deck-studio/docs/PARTNER-DECK-GROK-HANDOFF-PLAYBOOK.md"
  ],
  "slide_manifest": "slide-manifest.json",
  "content_source": "content-source.json",
  "image_manifest": "image-manifest.json",
  "rules": [
    "docs/LIVE-DECK-RULES.md",
    "docs/BRAND-RULES.md",
    "docs/IMAGE-RULES.md",
    "docs/PARTNER-DECK-GROK-HANDOFF-PLAYBOOK.md"
  ],
  "last_pulled_at": "2026-06-21T14:45:00Z",
  "notes": "Tasklet Wave 10A deck-prep config. Authority/regulator deck. Focus clean harbour-craft mandate, Singapore inner-waterfront, and exact-bound Batam/Bintan/Desaru/Riau candidates. Regional SEA examples outside Singapore must be source-labeled and not overclaimed as MPA scope. Grok must bind/create live deck ID, pull full inventory, apply through Slides API only, and return QA receipts."
}
