{
  "deck_key": "bolt",
  "deck_id": "1sQNF5P3OjhAlSh917yO6If1OPBGnwOBvrBzGXcYZh4c",
  "display_name": "Bolt × Navier",
  "deck_type": "partner_proposal",
  "partner_id": "bolt",
  "live_deck_url": "https://docs.google.com/presentation/d/1sQNF5P3OjhAlSh917yO6If1OPBGnwOBvrBzGXcYZh4c/edit",
  "canonical_market_scope": [
    "Greece — Athens/Saronic/Cyclades",
    "Croatia — Dalmatian coast",
    "Italy — Amalfi/Capri/Venice lagoon",
    "France — Côte d’Azur",
    "UAE — Dubai/Abu Dhabi",
    "Saudi Arabia — Jeddah/Red Sea"
  ],
  "editing_mode": "slides_api_only",
  "export_modes": [
    "pdf",
    "png_preview",
    "slides_summary",
    "slides_full_inventory"
  ],
  "brand_profile": "navier-gold-minimal",
  "image_policy": "n30_composite_only_no_atlas_images_market_specific_backgrounds",
  "economics_sheet_id": null,
  "economics_url": null,
  "source_paths": [
    "partner-pitch/partners/bolt.json",
    "data-clean/partners/bolt.json",
    "finance/recal/agg-bolt.json",
    "finance/growth-bolt.json",
    "finance/bolt-growth-case.json",
    "partner-pitch/partners/_growth-draft/bolt.growth.json",
    "finance/_sheet_out/bolt_unit_econ.xlsx",
    "data-clean/economics_by_route_id.json",
    "handoff/partner-map-model/multi-partner-deck-grok-handoff-2026-06-21/partner-deck-source-map.json",
    "handoff/partner-map-model/multi-partner-deck-grok-handoff-2026-06-21/partner-deck-grok-readiness-queue.json"
  ],
  "slide_manifest": "slide-manifest.json",
  "content_source": "content-source.json",
  "image_manifest": "image-manifest.json",
  "rules": [
    "docs/LIVE-DECK-RULES.md",
    "docs/BRAND-RULES.md",
    "docs/IMAGE-RULES.md",
    "docs/PARTNER-DECK-GROK-HANDOFF-PLAYBOOK.md"
  ],
  "last_pulled_at": "2026-06-21T14:34:46Z",
  "notes": "Tasklet deck-prep config for Bolt. Use current Bolt proposal baseline only; preserve constraints: no Mexico or Morocco, and Malaysia only Penang + Sabah/Kota Kinabalu if Malaysia is reintroduced. Exact city/route IDs only. Grok must bind/create a live deck ID, pull full inventory, and apply via Slides API only. Live deck created from Grab template copy for PR65 bind pass."
}
