{
  "deck_key": "grab",
  "deck_id": "11WCun1Xk1flPmqvvtYrYZXsL5yRb5KQoe0xvTQSppKo",
  "display_name": "Grab × Navier",
  "deck_type": "partner_proposal",
  "partner_id": "grab",
  "live_deck_url": "https://docs.google.com/presentation/d/11WCun1Xk1flPmqvvtYrYZXsL5yRb5KQoe0xvTQSppKo/edit",
  "canonical_market_scope": [
    "Singapore",
    "Indonesia",
    "Thailand",
    "Vietnam",
    "Malaysia",
    "Philippines",
    "Cambodia"
  ],
  "editing_mode": "slides_api_only",
  "export_modes": [
    "pdf",
    "png_preview",
    "slides_summary",
    "slides_full_inventory"
  ],
  "brand_profile": "navier-gold-minimal",
  "image_policy": "n30_composite_only_no_atlas_images",
  "economics_sheet_id": "1ACYTZar0odZCASzKUwo1A4rXGsCsz6Luec6Cu3vQ20w",
  "economics_url": "https://docs.google.com/spreadsheets/d/1ACYTZar0odZCASzKUwo1A4rXGsCsz6Luec6Cu3vQ20w/edit",
  "source_paths": [
    "partner-pitch/partners/grab.json",
    "data-clean/partners/grab.json",
    "finance/recal/agg-grab.json",
    "finance/recal/growth-grab.json"
  ],
  "slide_manifest": "slide-manifest.json",
  "content_source": "content-source.json",
  "image_manifest": "image-manifest.json",
  "rules": [
    "docs/LIVE-DECK-RULES.md",
    "docs/BRAND-RULES.md",
    "docs/IMAGE-RULES.md",
    "docs/PARTNER-DECK-GROK-HANDOFF-PLAYBOOK.md",
    "assets/IMAGE-ROLE-CONTRACT.md"
  ],
  "last_pulled_at": "2026-07-08T08:40:00Z",
  "notes": "Summary manifest pulled from live Google Slides. Full object inventory is intentionally a follow-up gate before object-specific edits. Current-spec refresh required: slide 3 KPIs, slide 10 TAM, six flush-left OPEX lines, cover logo/no-logo policy, and stable linked-image URL delivery only (no embedded-only image reuse). | 2026-07-08 manifest resync: prior slide-manifest described 18yDAgO0… (24-slide sibling duplicate); regenerated against config deck_id from live pull.",
  "generation_type": "refresh-to-current-spec",
  "spec_refresh_required": true,
  "current_spec_requirements": {
    "spec_version": "wave10a-current-2026-06-22",
    "slide_3_market_overview_kpis": {
      "status": "refresh_required",
      "source": "transparent economics sheet + master tracker",
      "rule": "no stale KPIs; null beats unsupported"
    },
    "slide_10_tam": {
      "status": "refresh_required",
      "source": "growth_case / TAM economics sidecar",
      "rule": "include economics sidecar in export package"
    },
    "unit_economics_opex_6_line": {
      "status": "refresh_required",
      "lines": 6,
      "layout": "flush_left",
      "field_id_policy": "pull live object IDs per slide before editing; never assume duplicated/recreated IDs"
    },
    "image_delivery": {
      "status": "required",
      "rule": "stable registry URL only; no embedded-only blobs or temporary googleusercontent contentUrl"
    }
  },
  "asset_policy": {
    "no_reembed": true,
    "image_insert_mode": "stable_registry_url_only",
    "allowed_sources": [
      "deck-studio/assets/ASSET-REGISTRY.json source_url",
      "approved Drive/asset-host URL recorded back into registry"
    ],
    "forbidden_sources": [
      "live Slides contentUrl",
      "lh*-googleusercontent temporary URLs",
      "copy/paste embedded-only binaries"
    ],
    "missing_asset_behavior": "block_or_leave_null"
  },
  "cover_logos": {
    "navier_logo": {
      "path": "assets/logos/navier/navier-wordmark-white.png",
      "required": true
    },
    "partner_logo": {
      "partner": "Grab",
      "asset_key": "grab-logo",
      "path": "assets/logos/partners/grab/grab-logo.png",
      "official_source": "https://www.grab.com",
      "required": true,
      "status": "banked_needs_stable_url_publish"
    },
    "cover_policy": "navier_plus_partner_logo"
  },
  "last_spec_refreshed_at": "2026-06-22T02:16:30Z"
}
