{
  "deck_key": "yassir",
  "deck_id": "1fqwFDPrLklNbxrS_0ibo5MsXa-iGT43uLZNMCvU4wMo",
  "display_name": "Yassir × Navier",
  "deck_type": "partner_proposal",
  "partner_id": "yassir",
  "live_deck_url": "https://docs.google.com/presentation/d/1fqwFDPrLklNbxrS_0ibo5MsXa-iGT43uLZNMCvU4wMo/edit",
  "canonical_market_scope": [
    "Morocco",
    "Tunisia",
    "Algeria",
    "Senegal"
  ],
  "editing_mode": "slides_api_only",
  "export_modes": [
    "pdf",
    "png_preview",
    "slides_summary",
    "slides_full_inventory"
  ],
  "brand_profile": "navier-gold-minimal",
  "image_policy": "n30_composite_only_no_atlas_images_market_specific_backgrounds",
  "economics_sheet_id": "1ba9Zpap5hPAehDKFHgk2PwRq4xStr2rx_z1LGSY52Q4",
  "economics_url": "https://docs.google.com/spreadsheets/d/1ba9Zpap5hPAehDKFHgk2PwRq4xStr2rx_z1LGSY52Q4/edit",
  "source_paths": [
    "partner-pitch/partners/yassir.json",
    "data-clean/partners/yassir.json",
    "finance/recal/agg-yassir.json",
    "finance/growth-yassir.json",
    "partner-pitch/partners/_growth-draft/yassir.growth.json",
    "finance/_sheet_out/yassir_unit_econ.xlsx"
  ],
  "slide_manifest": "slide-manifest.json",
  "content_source": "content-source.json",
  "image_manifest": "image-manifest.json",
  "rules": [
    "docs/LIVE-DECK-RULES.md",
    "docs/BRAND-RULES.md",
    "docs/IMAGE-RULES.md",
    "docs/PARTNER-DECK-GROK-HANDOFF-PLAYBOOK.md",
    "assets/IMAGE-ROLE-CONTRACT.md"
  ],
  "last_pulled_at": "2026-06-21T14:42:49Z",
  "notes": "Tasklet proposal-prep config. Scope is now 4 markets: Morocco, Tunisia, Algeria, Senegal (Algeria activated; Senegal added as 4th sub-proposal 2026-07-06). Logo banked (yassir-logo.png + LOGO-SOURCE.json committed). Live deck 1fqwFDPrLklNbxrS exists at 11-slide PR65 trim; parity target = Noon 17-slide structure (add partner-roles slide + one 'What one boat earns' marquee-corridor slide per market). BLOCKER: economics cascade for Senegal+Algeria must be spliced into partner growth_case before slides 3/7/10 + per-market economics slides are rebuilt (current growth_case still 43-boat/2-3-market floor). Slides API only, in place, no PPTX round-trip. Rename deck 'Yassir × Navier' (drop 'PR65 sandbox') at build. Parity plan: /tasklet/agent/home/yassir-maghreb/DECK-PARITY-PLAN-2026-07-06.md",
  "generation_type": "refresh-to-current-spec",
  "spec_refresh_required": true,
  "current_spec_requirements": {
    "spec_version": "wave10a-current-2026-06-22",
    "slide_3_market_overview_kpis": {
      "status": "refresh_required",
      "source": "transparent economics sheet + master tracker",
      "rule": "no stale KPIs; null beats unsupported"
    },
    "slide_10_tam": {
      "status": "refresh_required",
      "source": "growth_case / TAM economics sidecar",
      "rule": "include economics sidecar in export package"
    },
    "unit_economics_opex_6_line": {
      "status": "refresh_required",
      "lines": 6,
      "layout": "flush_left",
      "field_id_policy": "pull live object IDs per slide before editing; never assume duplicated/recreated IDs"
    },
    "image_delivery": {
      "status": "required",
      "rule": "stable registry URL only; no embedded-only blobs or temporary googleusercontent contentUrl"
    }
  },
  "asset_policy": {
    "no_reembed": true,
    "image_insert_mode": "stable_registry_url_only",
    "allowed_sources": [
      "deck-studio/assets/ASSET-REGISTRY.json source_url",
      "approved Drive/asset-host URL recorded back into registry"
    ],
    "forbidden_sources": [
      "live Slides contentUrl",
      "lh*-googleusercontent temporary URLs",
      "copy/paste embedded-only binaries"
    ],
    "missing_asset_behavior": "block_or_leave_null"
  },
  "cover_logos": {
    "navier_logo": {
      "path": "assets/logos/navier/navier-wordmark-white.png",
      "required": true
    },
    "partner_logo": {
      "partner": "Yassir",
      "asset_key": "yassir-logo",
      "path": "assets/logos/partners/yassir/yassir-logo.png",
      "official_source": "https://yassir.com",
      "required": true,
      "status": "banked"
    },
    "cover_policy": "navier_plus_partner_logo"
  },
  "last_spec_refreshed_at": "2026-06-22T02:16:30Z"
}